{
  "$schema": "http://json-schema.org/draft-07/schema#",
  "title": "Class",
  "type": "object",
  "required": [
    "name",
    "hitDie",
    "primaryAbility",
    "savingThrows"
  ],
  "properties": {
    "id": {
      "type": "string",
      "description": "kebab-case unique id; defaults to slug of name"
    },
    "name": {
      "type": "string"
    },
    "source": {
      "type": "string",
      "default": "5e SRD"
    },
    "flavor": {
      "type": "string",
      "description": "one-line evocative summary"
    },
    "hitDie": {
      "type": "integer",
      "enum": [
        6,
        8,
        10,
        12
      ]
    },
    "sizes": {
      "type": "array",
      "items": {
        "type": "string",
        "enum": [
          "Small",
          "Medium",
          "Large"
        ]
      },
      "minItems": 1,
      "description": "Character sizes a member of this class may be (MECHANICS 2.3). There are no races in this system: a player's appearance is entirely free and has no combat effect, but SIZE is a class constraint because two mechanics read off it — the Sandow's Mighty Build and the Impersonator's Mimic. Default is [\"Small\",\"Medium\"]; only the Sandow may be Large."
    },
    "speed": {
      "type": "integer",
      "minimum": 0,
      "maximum": 120,
      "multipleOf": 5,
      "default": 30,
      "description": "How far you walk on your turn, in feet. Thirty for everybody in this company — it is here because a dozen features are written in terms of \"half your speed\" and the number they are half OF was nowhere on the sheet, so a player had to know it from outside the app (Kayki, 2026-08-14: \"theres nowhere in the character sheet that they can see their speed\"). A class that ought to move differently now has somewhere to say so."
    },
    "primaryAbility": {
      "type": "string"
    },
    "attackAbility": {
      "type": "object",
      "additionalProperties": false,
      "description": "Overrides which ability a WEAPON attack uses, when a class feature says so (the Joker's Charisma on finesse weapons). Machine-readable on purpose: the sheet computes a to-hit and a damage bonus per weapon, and must never parse the feature's prose to find out which stat to use. Omit for every class that uses the default rule (finesse = the better of Strength and Dexterity, otherwise Strength).",
      "required": [
        "ability"
      ],
      "properties": {
        "ability": {
          "type": "string",
          "enum": [
            "Strength",
            "Dexterity",
            "Constitution",
            "Intelligence",
            "Wisdom",
            "Charisma"
          ]
        },
        "property": {
          "type": "string",
          "description": "Only applies to weapons carrying this property (e.g. 'finesse'). Omit to apply to every weapon."
        },
        "note": {
          "type": "string",
          "description": "One line shown on the sheet's Attacks table saying which feature grants this."
        }
      }
    },
    "savingThrows": {
      "type": "array",
      "items": {
        "type": "string"
      },
      "minItems": 2,
      "maxItems": 2
    },
    "subclassLevel": {
      "type": "integer",
      "minimum": 1
    },
    "proficiencies": {
      "type": "object",
      "properties": {
        "armor": {
          "type": "array",
          "items": {
            "type": "string"
          }
        },
        "weapons": {
          "type": "array",
          "items": {
            "type": "string"
          }
        },
        "tools": {
          "type": "array",
          "items": {
            "type": "string"
          }
        },
        "skills": {
          "type": "string"
        }
      }
    },
    "features": {
      "type": "array",
      "items": {
        "type": "object",
        "required": [
          "level",
          "name",
          "description"
        ],
        "properties": {
          "level": {
            "type": "integer",
            "minimum": 1,
            "maximum": 20
          },
          "name": {
            "type": "string"
          },
          "description": {
            "type": "string"
          },
          "role": {
            "type": "string",
            "enum": [
              "combat",
              "roleplay"
            ],
            "description": "What the feature is for. Omitted = combat. Roleplay features are for dialogue, exploration, and improvised attempts outside combat."
          },
          "panel": {
            "type": "string",
            "enum": [
              "tricks",
              "engine"
            ],
            "description": "This feature only ANNOUNCES a subsystem that a character sheet already renders as its own panel — \"You gain the Grit pool, see the engine\", \"Full caster from level 1, you know the whole list\". It stays on the class page, where it explains what the class IS, and is left off the sheet, where repeating it beside the live Engine or Tricks panel is noise. Declared here rather than matched on the feature's NAME, which is prose and drifts."
          },
          "narration": {
            "type": "string",
            "description": "The IN-PLAY tab: how this looks, sounds, and is performed at the table when it happens mid-fight — the swing, the dodge, the wire going taut, what the crowd sees. Pure fiction, ZERO numbers: never restate a die, a DC, a range, a cost, or a condition name here (those live in the mechanics tab). 2-4 sentences. Written second person, present tense."
          },
          "sheetSummary": {
            "type": "string",
            "description": "REQUIRED EVENTUALLY on every feature (backfill before character creation ships). The condensed text shown on a player's character sheet: ONLY what it does — effect, damage + type, conditions applied, cost/uses. Cut all flavor and 'why/how' prose. Features with `options` keep their full options table on the sheet regardless (Wild Card and the like are pertinent info)."
          },
          "meta": {
            "type": "object",
            "description": "At-a-glance combat fields shown as labelled chips below the feature (D&D Beyond style). All optional; author what applies. Every actionable feature should at least set `action`.",
            "properties": {
              "action": {
                "type": "string",
                "description": "Action economy: Action / Bonus Action / Reaction / Free / Passive / Movement / Part of Attack / Special."
              },
              "cost": {
                "type": "string",
                "description": "Resource spent, e.g. '1 Mayhem', '1-3 Grit', '1 Clone'."
              },
              "uses": {
                "type": "string",
                "description": "Usage limit, e.g. '1 / turn', 'Cha mod / long rest', '1 / round'."
              },
              "range": {
                "type": "string",
                "description": "Range or area, e.g. '30 ft', 'Self', '5 ft', '10-ft radius'."
              },
              "save": {
                "type": "string",
                "description": "Save it forces, e.g. 'Dex save vs your DC'."
              }
            }
          },
          "options": {
            "type": "array",
            "description": "For a feature that offers a menu of choices or a random table (e.g. the Joker's Gambit or Wild Card). The renderer shows these as a table so the choices are scannable; `description` holds the intro text. Author any multi-option feature this way rather than cramming the options into prose.",
            "items": {
              "type": "object",
              "required": [
                "name",
                "effect"
              ],
              "properties": {
                "roll": {
                  "type": [
                    "integer",
                    "string"
                  ],
                  "description": "Optional die result for a random table (e.g. 1-8 for a d8). Omit for a pick-one menu."
                },
                "group": {
                  "type": "string",
                  "description": "Optional grouping label. Rows sharing a label render as their own table under that heading, so effects that always apply are never mixed in with a menu you pick from. Omit it and all rows render as one table, as before."
                },
                "name": {
                  "type": "string",
                  "description": "Short name of the option/result."
                },
                "effect": {
                  "type": "string",
                  "description": "What it does. May contain [[XdY]] scaling-die tokens."
                }
              }
            }
          },
          "board": {
            "$ref": "#/definitions/board",
            "description": "Optional. What this feature puts on the map, for the virtual table — an area, a figure that appears, a figure that is moved. See data/schema/board.schema.json."
          }
        }
      }
    },
    "parryBaseDC": {
      "type": "integer",
      "minimum": 1,
      "maximum": 20,
      "description": "Circus-system Parry v2: this class's base Parry DC (lower = easier to parry / better parrier). Feeds the effective Parry DC formula (proficiency + half defense-ability modifier subtracted, situational modifiers added, floor of 3). See data/schema/MECHANICS.md §1.5-1.6. Roster spread is 8 (Acrobat, best) to 15 (Puppeteer, worst); The Sandow and the Doppelganger both sit at 10. Two classes MAY share a value — the ordering is what carries the design, not one integer each. Optional/omit for non-circus (e.g. 5e SRD) classes that don't use the rebuilt Parry reaction. REPLACES the removed v1 'parryAffinity' tier field — do not reintroduce parryAffinity."
    },
    "defenseAbility": {
      "type": "string",
      "enum": [
        "Strength",
        "Dexterity",
        "Constitution",
        "Intelligence",
        "Wisdom",
        "Charisma"
      ],
      "default": "Dexterity",
      "description": "Ability score whose modifier feeds any Riposte/feature that makes an ATTACK ROLL, at full value (data/schema/MECHANICS.md §1.9-1.10). NOTE (v4): this NO LONGER affects the Parry DC — the DC is fixed and does not scale with ability (§1.5). Currently vestigial: none of the shipped Ripostes roll to hit, so the field has no active effect yet — it is reserved for future roll-to-hit content. CONVENTION: still set it to the class's own primaryAbility. Defaults to Dexterity if omitted."
    },
    "parryReskin": {
      "type": "string",
      "description": "Flavor text for how this class's Parry outcome narrates (e.g. 'a clone phases in to eat the hit'). See data/schema/MECHANICS.md §1.4."
    },
    "riposte": {
      "type": [
        "string",
        "null"
      ],
      "description": "Free text describing a Full-Dodge-only (d20 roll strictly above the effective Parry DC) counterattack effect, if this class has one. Null/omit if the class has no riposte. See data/schema/MECHANICS.md §1.9."
    },
    "keyStats": {
      "type": "array",
      "description": "Derived at-a-glance numbers for this class's own mechanic — its save/effect DC (e.g. 'Gambit DC', 'Control DC'), resource cap, base Parry DC, and any other headline value a player needs up front. The renderer shows these in a stat block at the top of the class sheet (like a Monk's Ki save DC / Martial Arts die). Author one entry per headline number; every class with a mechanic should have this so its numbers are visible without reading the feature prose.",
      "items": {
        "type": "object",
        "properties": {
          "label": {
            "type": "string",
            "description": "Short name of the stat, e.g. 'Gambit DC', 'Momentum Cap', 'Parry Base DC'."
          },
          "value": {
            "type": "string",
            "description": "The at-a-glance display: a short typical progression a player can read instantly, e.g. '≈4 (L1) · 6 (L9+)'. Keep the raw formula out of here — put it in `formula` so it shows on hover instead. If there is no formula (a flat number like a Parry DC), this can just be that number."
          },
          "formula": {
            "type": "string",
            "description": "Optional exact calculation shown in a hover tooltip on the value (mirrors the [[XdY]] scaling-die tooltip), e.g. 'Constitution modifier + proficiency bonus (minimum 3)'. Use this for any value derived from ability modifiers or proficiency so the confusing math is available on demand but not cluttering the at-a-glance number."
          },
          "note": {
            "type": "string",
            "description": "Optional one-line explanation of what the stat governs."
          }
        },
        "required": [
          "label",
          "value"
        ]
      }
    },
    "engine": {
      "type": "object",
      "description": "This class's own resource/engine (Momentum, Grit, Chaos deck, clone tokens, etc.) — its sole resource. See data/schema/MECHANICS.md.",
      "properties": {
        "name": {
          "type": "string",
          "description": "In-fiction name of the resource, e.g. 'Momentum', 'Grit', 'Chaos Deck'."
        },
        "resourceType": {
          "type": "string",
          "enum": [
            "pool",
            "stack",
            "tokens",
            "deck",
            "charges",
            "other"
          ],
          "description": "Shape of the resource for renderer/UI purposes."
        },
        "description": {
          "type": "string",
          "description": "What the resource represents and how it behaves in general."
        },
        "generation": {
          "type": "string",
          "description": "How the resource is earned/refreshed."
        },
        "spend": {
          "type": "string",
          "description": "How the resource is spent and what it buys."
        },
        "cap": {
          "type": [
            "integer",
            "string"
          ],
          "description": "Max resource value, as an at-a-glance typical progression (e.g. '≈4 (L1–4) · 5–6 (L5+)'). Keep the raw formula out of here — put it in `capFormula` so it shows on hover instead. A flat integer is fine for a non-scaling cap."
        },
        "capFormula": {
          "type": "string",
          "description": "Optional exact cap calculation shown in a hover/tap tooltip on the Cap value (mirrors keyStats.formula), e.g. 'Constitution modifier + proficiency bonus (minimum 3)'."
        },
        "capMath": {
          "type": "object",
          "description": "MACHINE-READABLE cap, so no code ever parses `capFormula`'s English to get a number. cap = base + (prof x proficiency bonus) + (ability modifier), raised to `min` if given, then + `bonusAtLevel5` from level 5. Keep it in step with capFormula, which is the human-facing version.",
          "properties": {
            "base": {
              "type": "integer"
            },
            "prof": {
              "type": "integer"
            },
            "ability": {
              "type": "string",
              "enum": [
                "Strength",
                "Dexterity",
                "Constitution",
                "Intelligence",
                "Wisdom",
                "Charisma"
              ]
            },
            "min": {
              "type": "integer"
            },
            "bonusAtLevel5": {
              "type": "integer"
            }
          },
          "additionalProperties": false
        }
      }
    },
    "play": {
      "type": "object",
      "additionalProperties": false,
      "description": "Hooks the live character sheet reads. Machine-readable ON PURPOSE — the engine's `generation` prose is for humans and must never be parsed for a number (same lesson as capMath).",
      "properties": {
        "autoRefill": {
          "type": "string",
          "enum": [
            "turn"
          ],
          "description": "Engine refills to its cap at the start of each of the character's turns (the Juggler's Set). Omit for every pool that is built rather than refilled."
        },
        "triggers": {
          "type": "array",
          "description": "One button each on the sheet: the things that GAIN engine, in the player's own words.",
          "items": {
            "type": "object",
            "required": [
              "id",
              "label",
              "gain"
            ],
            "additionalProperties": false,
            "properties": {
              "id": {
                "type": "string"
              },
              "label": {
                "type": "string"
              },
              "gain": {
                "type": "integer"
              },
              "oncePerTurn": {
                "type": "boolean",
                "description": "Greys out until the player ends their turn."
              }
            }
          }
        },
        "states": {
          "type": "array",
          "description": "Class-specific toggles beyond the universal conditions. Never inferred — the app does not see the dice.",
          "items": {
            "type": "object",
            "required": [
              "id",
              "label"
            ],
            "additionalProperties": false,
            "properties": {
              "id": {
                "type": "string"
              },
              "label": {
                "type": "string"
              },
              "why": {
                "type": "string"
              },
              "subclass": {
                "type": "string",
                "description": "Only offered if the character has this subclass."
              }
            }
          }
        }
      }
    }
  }
}
