{
  "id": "joker",
  "name": "Joker",
  "source": "Circus System",
  "flavor": "A chaos menace with a deck of razor cards and a grin that never quite fits the moment — he wins by making sure no one, least of all himself, knows what happens next.",
  "hitDie": 10,
  "sizes": [
    "Small",
    "Medium"
  ],
  "primaryAbility": "Charisma",
  "savingThrows": [
    "Charisma",
    "Dexterity"
  ],
  "subclassLevel": 3,
  "proficiencies": {
    "armor": [
      "Light armor",
      "Medium armor"
    ],
    "weapons": [
      "Razor Cards",
      "Harlequin's Cane",
      "Dagger"
    ],
    "tools": [
      "Playing card set",
      "Forgery kit"
    ],
    "skills": "Choose two from Acrobatics, Deception, Intimidation, Performance, Persuasion, and Sleight of Hand"
  },
  "parryBaseDC": 11,
  "defenseAbility": "Charisma",
  "parryReskin": "A lunatic, last-second contortion — a mad twist of the spine or a limb bent the wrong way at the worst possible instant. He never dodges the sane way, and the crowd can never tell whether it was skill or dumb luck.",
  "riposte": "On a Full Dodge (your Parry d20 roll comes up strictly above your effective Parry DC), the triggering attacker must succeed on a Charisma saving throw against your gambit DC or suffer a minor mishap: its next attack roll before the start of your next turn is made with disadvantage.",
  "engine": {
    "name": "Mayhem",
    "resourceType": "pool",
    "description": "A small pool of chaotic energy built from doing risky, unpredictable things in a fight and spent to draw Wild Cards and fuel Gambits. The Joker's sole resource — deliberately kept small so its swings stay bounded rather than build into a snowball.",
    "generation": "Gain 1 Mayhem the first time each turn you deal damage to a creature, AND gain 1 Mayhem the first time each turn you take damage, AND gain 1 Mayhem the first time each turn you roll a natural 1 or a natural 20 on an attack roll, ability check, or saving throw — three separate sources, each capped at once per turn (all three triggering in the same turn grants 3 Mayhem total; a source that already triggered this turn grants no more). This works from 1st level. None of these sources ever trigger off a Trick: damage you deal with a Trick, and rolls you make as part of one, generate no Mayhem. Your Tricks are free precisely because they don't feed the meter.",
    "spend": "Spend Mayhem in 1-point increments, at no action cost beyond the triggering feature, to draw Wild Cards, fuel your Gambits, and pay for your other Mayhem-keyed features. Unspent Mayhem carries over between rounds, but never between fights: you start every combat with 0 Mayhem and any left over is lost the moment the fight ends. Mayhem is a per-combat currency like every other engine in this system — it is built during a fight and cannot be banked before one.",
    "cap": "≈4–5 (L1–4) · 6+ (L5+)",
    "capFormula": "proficiency bonus + Charisma modifier (minimum 3)",
    "capMath": {
      "prof": 1,
      "ability": "Charisma",
      "min": 3
    }
  },
  "features": [
    {
      "level": 1,
      "name": "Mayhem",
      "description": "You gain the Mayhem pool, a resource built from doing risky, chaotic things in a fight and spent to fuel your Wild Cards and Gambits. See your Mayhem engine for exactly how it is generated, spent, and capped.",
      "narration": "Every stupid, reckless, funny thing you do in a fight winds you tighter. You are grinning too much for someone bleeding this freely, and the pressure of it builds behind your teeth until you spend it on something nobody could have planned for.",
      "sheetSummary": "You gain the Mayhem pool. See the Mayhem engine for generation, spending, and cap.",
      "meta": {
        "action": "Passive"
      }
    },
    {
      "level": 1,
      "name": "Wild Talent",
      "description": "Your chaos answers your personality, not your hands: you use your Charisma modifier, instead of Strength or Dexterity, for attack and damage rolls you make with a finesse weapon you're proficient with (your Razor Cards, Harlequin's Cane, or Dagger). Any saving throw a Joker feature or Wild Card forces on a creature uses your {{gambit DC|8 + proficiency bonus + Charisma modifier}}.",
      "narration": "You do not fight like someone who trained. You fight like someone talking — the whole thing runs on nerve and timing and the absolute confidence that the card will go where you said it would, and somehow it does.",
      "sheetSummary": "Passive. Use your Charisma modifier for attack and damage rolls with a finesse weapon you're proficient with. Every save a Joker feature or Wild Card forces uses your {{gambit DC|8 + proficiency bonus + Charisma modifier}}.",
      "meta": {
        "action": "Passive"
      }
    },
    {
      "level": 1,
      "name": "Wild Card",
      "description": "As a bonus action, spend 1 Mayhem to draw a Wild Card: roll a d8 and immediately resolve the matching result below, with no further action needed. Any saving throw listed is a Charisma saving throw against your gambit DC. Drawing costs a bonus action and 1 Mayhem, so it happens at most once per turn.",
      "narration": "You draw off the top without looking and let the deck decide what happens next. So does everyone else. The card turns over, the room finds out together, and for one second you are as surprised as anybody — you just hide it better.",
      "sheetSummary": "Bonus action, 1/turn, 1 Mayhem. Roll a d8 and resolve the matching result. Saves listed are Charisma saves vs {{gambit DC|8 + proficiency bonus + Charisma modifier}}.",
      "options": [
        {
          "roll": 1,
          "name": "Ace Up the Sleeve",
          "effect": "You have advantage on the next attack roll or saving throw you make before the end of your next turn."
        },
        {
          "roll": 2,
          "name": "Marked Card",
          "effect": "The next attack you hit with before the end of your next turn deals an extra [[1d6]] damage of that weapon's damage type."
        },
        {
          "roll": 3,
          "name": "Contagious Cackle",
          "effect": "Choose one creature you can see within 30 feet; it must succeed on a saving throw or its next attack roll before the start of your next turn is made with disadvantage."
        },
        {
          "roll": 4,
          "name": "Quick Vanish",
          "effect": "Until the end of your turn your speed increases by 10 feet, and you don't provoke opportunity attacks when you move away from a hostile creature this turn."
        },
        {
          "roll": 5,
          "name": "Second Wind",
          "effect": "You regain [[1d4]] + your Charisma modifier hit points (minimum 1)."
        },
        {
          "roll": 6,
          "name": "Wild Swap",
          "effect": "The deck turns on you for a moment — choose one hostile creature within 30 feet of you; it has advantage on the next attack roll it makes against you before the start of your next turn."
        },
        {
          "roll": 7,
          "name": "Static Shock",
          "effect": "A spark of raw chaos jumps back through your own hand and you take [[1d4]] psychic damage."
        },
        {
          "roll": 8,
          "name": "Encore",
          "effect": "If you have at least 1 Mayhem remaining, you may immediately spend it to draw again, rerolling on this table and resolving only the new result (this draw itself does nothing); if you have no Mayhem left, this draw has no further effect."
        }
      ],
      "meta": {
        "action": "Bonus Action",
        "cost": "1 Mayhem",
        "uses": "1 / turn",
        "range": "Self / 30 ft",
        "save": "Cha save vs {{gambit DC|8 + proficiency bonus + Charisma modifier}} (some results)"
      }
    },
    {
      "level": 1,
      "name": "Chaotic Parry",
      "description": "Once per turn when you Parry, after seeing the result, you may spend 1 Mayhem to reroll your Parry d20 — you must use the new roll, even if it is worse. Every Parry of yours narrates as a lunatic, last-second contortion rather than a clean block; the crowd can never tell whether it was skill or dumb luck.",
      "narration": "Your defence is not a block. It is a stumble, a duck that turns into a spin, a hand thrown up at the last possible instant — and when it looks like it went badly you simply refuse the result and flail your way into a better one. Nobody can tell whether you meant any of it. Neither can you.",
      "sheetSummary": "1/turn, 1 Mayhem. After seeing your Parry result, reroll the Parry d20. You must use the new roll even if it is worse.",
      "meta": {
        "action": "When you Parry",
        "cost": "1 Mayhem",
        "uses": "1 / turn",
        "range": "Self"
      }
    },
    {
      "level": 1,
      "name": "Trickster's Luck",
      "description": "The deck looks after its own. {{uses per combat|1 at levels 1-4, 2 at 5-10, 3 at 11-16, 4 at 17+ — the same breakpoints the Scaling Die uses}} times per combat, when you roll below your effective Parry DC (an Overcommitted result), you can treat that Parry as a Grazing Parry instead — taking half damage rather than +50%. You decide after seeing the roll. This doesn't change your Parry DC, only how badly a failed one lands.",
      "narration": "The blow that should have opened you up somehow only skims. A boot slips, a lamp swings, the floor is fractionally where it needed to be — the deck looks after its own, and you take the graze with an expression that suggests you arranged it.",
      "sheetSummary": "Free, {{uses per combat|1 at levels 1-4, 2 at 5-10, 3 at 11-16, 4 at 17+ — the same breakpoints the Scaling Die uses}} times per combat. Treat an Overcommitted Parry as a Grazing Parry instead (half damage rather than +50%). Decided after seeing the roll; your Parry DC is unchanged.",
      "meta": {
        "action": "Free",
        "uses": "Scaling: 1/2/3/4 per combat",
        "range": "Self"